{
  "gate_record_id": "GR-G0b-0001",
  "gate": "G0b",
  "engagement_id": "eng-acme-invoices-2026q4",
  "run_id": "run-2026-09-23-001",
  "round": 1,
  "artifact": {
    "kind": "roe",
    "sha256": "sha256:8cbdc9389af8ec2ea7b82330d7d643d12bc2b6bb576b94eb556a15f0c9a3d4e4"
  },
  "job_id": null,
  "g4_gate_record_id": null,
  "initiator": "alice",
  "approvers": [
    {
      "person_id": "alice",
      "role": "test_lead",
      "key_fingerprint": "ed25519:SHA256:Ky18wBOUaXHcEHxhUsM/vuhUCjGa9bY7wyIGXDDoK1o"
    },
    {
      "person_id": "carol",
      "role": "management",
      "key_fingerprint": "ed25519:SHA256:raVQ7so30NzKYQXvVVAC60cao19GTQKdsz1Xbu2O170"
    },
    {
      "person_id": "dave",
      "role": "infrastructure_owner",
      "key_fingerprint": "ed25519:SHA256:IPO3dJJ8KKWIfdOok1Q7rGKMls2YIXxQu5BB/d5tVLQ"
    }
  ],
  "outcome": "VERIFIED",
  "decisions": [
    {
      "item_id": "roe:eng-acme-invoices-2026q4@1",
      "item_sha256": "sha256:8cbdc9389af8ec2ea7b82330d7d643d12bc2b6bb576b94eb556a15f0c9a3d4e4",
      "decision": "accept",
      "risk_override": null,
      "note": null,
      "carried_from": null
    }
  ],
  "gb": null,
  "verification": {
    "document_ref": "sha256:8cbdc9389af8ec2ea7b82330d7d643d12bc2b6bb576b94eb556a15f0c9a3d4e4",
    "key_registry_version": 4,
    "signer_results": [
      {
        "person_id": "alice",
        "key_fingerprint": "ed25519:SHA256:Ky18wBOUaXHcEHxhUsM/vuhUCjGa9bY7wyIGXDDoK1o",
        "ok": true,
        "reason": null
      },
      {
        "person_id": "carol",
        "key_fingerprint": "ed25519:SHA256:raVQ7so30NzKYQXvVVAC60cao19GTQKdsz1Xbu2O170",
        "ok": true,
        "reason": null
      },
      {
        "person_id": "dave",
        "key_fingerprint": "ed25519:SHA256:IPO3dJJ8KKWIfdOok1Q7rGKMls2YIXxQu5BB/d5tVLQ",
        "ok": true,
        "reason": null
      },
      {
        "person_id": "grace",
        "key_fingerprint": "ed25519:SHA256:J0LcrVkCA9yHiPokgJewx172vyto12+LeL7hkCqSp8w",
        "ok": true,
        "reason": null
      }
    ]
  },
  "opened_at": "2026-10-01T08:59:00+08:00",
  "timestamp": "2026-10-01T20:00:00+08:00",
  "signatures": []
}
