{
  "gate_record_id": "GR-G1-0001",
  "gate": "G1",
  "engagement_id": "eng-acme-invoices-2026q4",
  "run_id": "run-2026-09-23-001",
  "round": 1,
  "artifact": {
    "kind": "invariants",
    "sha256": "sha256:63f7decc0f82688ab87a952fe705fa3f3b6a9a1ce492c81109898cc2b401edae"
  },
  "job_id": null,
  "g4_gate_record_id": null,
  "initiator": "alice",
  "approvers": [
    {
      "person_id": "alice",
      "role": "app_owner",
      "key_fingerprint": "ed25519:SHA256:Ky18wBOUaXHcEHxhUsM/vuhUCjGa9bY7wyIGXDDoK1o"
    }
  ],
  "outcome": "APPROVED",
  "decisions": [
    {
      "item_id": "INV-AC-007",
      "item_sha256": "sha256:b858889cd46927ec075d3f0f312d48a9e4f8bbe8fb78a432fc5dae90f71ea4fa",
      "decision": "accept",
      "risk_override": null,
      "note": null,
      "carried_from": null
    },
    {
      "item_id": "INV-LLM-003",
      "item_sha256": "sha256:8a61198e2f16a652ffb63e9408e2906299421c34e8e58a5c12f1d61c18944c79",
      "decision": "accept",
      "risk_override": null,
      "note": null,
      "carried_from": null
    }
  ],
  "gb": null,
  "verification": null,
  "opened_at": "2026-09-23T15:00:00+08:00",
  "timestamp": "2026-09-24T11:00:00+08:00",
  "signatures": [
    {
      "signer": "alice",
      "key_fingerprint": "ed25519:SHA256:Ky18wBOUaXHcEHxhUsM/vuhUCjGa9bY7wyIGXDDoK1o",
      "alg": "ed25519",
      "value": "dh7TRUcwB3eyqRIXJmJdNhPeZNdt8bzTTdSPGatAXP/Mrbf2/7nyhEviW3pU9t4WnkS3MRSBrpJNL6UTrmF/Ag=="
    }
  ]
}
