{
  "gate_record_id": "GR-G0a-0003",
  "gate": "G0a",
  "engagement_id": "eng-acme-invoices-2026q4",
  "run_id": "run-2026-09-25-pr-118",
  "round": 1,
  "artifact": {
    "kind": "engagement",
    "sha256": "sha256:9e114e3a2acdfeffc23455bd0b6ac933695f1955056c5eded2ab22137b0e33b3"
  },
  "job_id": null,
  "g4_gate_record_id": null,
  "initiator": null,
  "approvers": [
    {
      "person_id": "frank",
      "role": "app_owner",
      "key_fingerprint": "ed25519:SHA256:jxVczmwwV1UVWwc1NkHUt22Xr+cvAoyjbxumX4TLJE0"
    },
    {
      "person_id": "carol",
      "role": "management",
      "key_fingerprint": "ed25519:SHA256:raVQ7so30NzKYQXvVVAC60cao19GTQKdsz1Xbu2O170"
    }
  ],
  "outcome": "VERIFIED",
  "decisions": [
    {
      "item_id": "eng-acme-invoices-2026q4",
      "item_sha256": "sha256:9e114e3a2acdfeffc23455bd0b6ac933695f1955056c5eded2ab22137b0e33b3",
      "decision": "accept",
      "risk_override": null,
      "note": null,
      "carried_from": null
    }
  ],
  "gb": null,
  "verification": {
    "document_ref": "sha256:9e114e3a2acdfeffc23455bd0b6ac933695f1955056c5eded2ab22137b0e33b3",
    "key_registry_version": 4,
    "signer_results": [
      {
        "person_id": "frank",
        "key_fingerprint": "ed25519:SHA256:jxVczmwwV1UVWwc1NkHUt22Xr+cvAoyjbxumX4TLJE0",
        "ok": true,
        "reason": null
      },
      {
        "person_id": "carol",
        "key_fingerprint": "ed25519:SHA256:raVQ7so30NzKYQXvVVAC60cao19GTQKdsz1Xbu2O170",
        "ok": true,
        "reason": null
      }
    ]
  },
  "opened_at": "2026-09-25T14:00:00+08:00",
  "timestamp": "2026-09-25T14:00:00+08:00",
  "signatures": []
}
