{
  "gate_record_id": "GR-G2-0001",
  "gate": "G2",
  "engagement_id": "eng-acme-invoices-2026q4",
  "run_id": "run-2026-09-23-001",
  "round": 1,
  "artifact": {
    "kind": "disputed_clusters",
    "sha256": "sha256:52b0e131d25a8375a3488fa8b3f11042331b2fec007346601c7101a2d23e322f"
  },
  "job_id": null,
  "g4_gate_record_id": null,
  "initiator": "alice",
  "approvers": [
    {
      "person_id": "alice",
      "role": "security_reviewer",
      "key_fingerprint": "ed25519:SHA256:Ky18wBOUaXHcEHxhUsM/vuhUCjGa9bY7wyIGXDDoK1o"
    }
  ],
  "outcome": "APPROVED",
  "decisions": [
    {
      "item_id": "K-011",
      "item_sha256": "sha256:ebce848afb584900264b8decf79ba9e4682215ee252bd9f7ea56aaea9db54b8f",
      "decision": "accept",
      "risk_override": null,
      "note": "高嚴重度、只有一個家族回報；保留進 B 階段以測試驗證",
      "carried_from": null
    },
    {
      "item_id": "K-015",
      "item_sha256": "sha256:cb9077210d30a019c8a75a713a506a3362822a20c0b7ed668337ee63a9968b44",
      "decision": "accept",
      "risk_override": null,
      "note": "RLS 未啟用的表；保留給 W4 的本地 RLS 測試與 B 階段驗證",
      "carried_from": null
    },
    {
      "item_id": "K-016",
      "item_sha256": "sha256:cff2f4d5f129283b235b96e8d2b88306e938a0ed44ebb799fc4e5a0bbe6a8c12",
      "decision": "accept",
      "risk_override": null,
      "note": "只有工具回報；沒有獨立來源，列入報告（report_only）",
      "carried_from": null
    }
  ],
  "gb": null,
  "verification": null,
  "opened_at": "2026-09-25T12:00:00+08:00",
  "timestamp": "2026-09-28T10:00:00+08:00",
  "signatures": [
    {
      "signer": "alice",
      "key_fingerprint": "ed25519:SHA256:Ky18wBOUaXHcEHxhUsM/vuhUCjGa9bY7wyIGXDDoK1o",
      "alg": "ed25519",
      "value": "HM8FmYYgkwswBE5YSj81Jc4XC33zIwA0f/lON40W9YfqeQBdHTVLQnVJmsiY93anCskf6BgYfvmOCOTlm+DBCQ=="
    }
  ]
}
